product,rating,rating count,price,product url
"Unlocked Smartphones, Blackview A55, 2022 Unlocked Cell Phones Android 11, 6.528"" HD+, 3GB RAM 16GB ROM, 4780mAh High Capacity Battery, 3-Card Slots, 4G Dual SIM,8MP+5MP,Face ID, T-Mobile Phone,Green  ",3.8 out of 5 stars,929  ,109.,https://amazon.com/Unlocked-Smartphones-Blackview-Capacity-T-Mobile/dp/B09SWHJX1B/ref=sr_1_65?keywords=smartphones&qid=1662383190&sr=8-65
"Rugged Smartphone, Blackview BV8800, 8GB+128GB, 8380mAh Battery with 33W Fast Charge, 4G Dual Sim Unlocked Cell Phones, 50MP+16MP+8MP+2MP+20MP IR Rear Camera, 6.58“FHD Display, IP68 & IP69K Waterproof  ",4.5 out of 5 stars,45  ,349.,https://amazon.com/Smartphone-Blackview-8380mAh-Unlocked-Waterproof/dp/B09WR95X1M/ref=sr_1_66?keywords=smartphones&qid=1662383190&sr=8-66
Nokia C01 Plus | Android 11 (Go Edition) | Unlocked Smartphone | 2-Day Battery | 2/32GB | 6.52-Inch Screen | Dark Blue  ,3.7 out of 5 stars,336  ,86.,https://amazon.com/Nokia-Factory-Unlocked-Android-Verizon/dp/B09CBSS3BX/ref=sr_1_67?keywords=smartphones&qid=1662383190&sr=8-67
"Samsung Galaxy A12 64GB Dual SIM, GSM Unlocked, (CDMA Verizon/Sprint Not Supported) Smartphone International Version No Warranty (White)  ",4.4 out of 5 stars,100  ,162.,https://amazon.com/Unlocked-Supported-Smartphone-International-Warranty/dp/B09J9B17GD/ref=sr_1_68?keywords=smartphones&qid=1662383190&sr=8-68
KLOKOL Bluetooth Headphones Neckband 20Hrs Playtime V5.0 Wireless Headset Sport Noise Cancelling Earbuds w/Mic for Gym Running Compatible with iPhone Samsung Android  ,4.2 out of 5 stars,"7,658  ",19.,https://amazon.com/gp/slredirect/picassoRedirect.html/ref=pa_sp_btf_aps_sr_pg4_1?ie=UTF8&adId=A04262762ZBNZSNB6Y0L7&url=%2FKLOKOL-Bluetooth-Headphones-Cancelling-Compatible%2Fdp%2FB09J3FG5F8%2Fref%3Dsr_1_69_sspa%3Fkeywords%3Dsmartphones%26qid%3D1662383190%26sr%3D8-69-spons%26psc%3D1%26smid%3DA1MCZTADDFQ4V6&qualifier=1662383190&id=5698325621186622&widgetName=sp_btf
"TCL 10L, Unlocked Android Smartphone, 256GB+6GB RAM Android Phone,6.53"" FHD Cell Phone, 48MP Quad Rear Camera System, 4000mAh Verizon Phone Mobile Phone Large Storage, Arctic White  ",4.2 out of 5 stars,"4,671  ",299.,https://amazon.com/gp/slredirect/picassoRedirect.html/ref=pa_sp_btf_aps_sr_pg4_1?ie=UTF8&adId=A0235091S398ERUYGO9C&url=%2FTCL-Unlocked-Android-Smartphone-Display%2Fdp%2FB0951TM7JS%2Fref%3Dsr_1_70_sspa%3Fkeywords%3Dsmartphones%26qid%3D1662383190%26sr%3D8-70-spons%26psc%3D1&qualifier=1662383190&id=5698325621186622&widgetName=sp_btf
